{
  "id": "63fe4617-4cac-47a5-9b93-6794514c35ad",
  "name": "Megumin",
  "displayName": "Megumin",
  "dark": true,
  "author": "cyclic-reference",
  "group": "KonoSuba",
  "editorScheme": {
    "type": "templateExtension",
    "file": "Megumin.xml"
  },
  "stickers": {
    "default": "megumin.png"
  },
  "colors": {
    "baseIconColor": "#979087",
    "ghostColor": "#FFFFFF00",
    "contrastColor": "#2e2b32",
    "nonProjectFileScopeColor":  "#312A26",
    "editorBackground": "#2f2329",
    "secondaryBackground": "#2f2329",
    "selectionForeground": "#E2CB14",
    "inactiveBackground": "#2a272e",
    "inactiveBackgroundDarker": "#333037",
    "headerColor": "#2f2329",
    "baseBackground": "#271c21",
    "borderColor": "#32262c",
    "buttonColor":  "#2f2329",
    "selectionInactive": "#2a272e",
    "tagColor": "#7A7A7A",
    "secondaryForegroundColor": "#766B6B",
    "selectionBackground":  "#563036",
    "selectionBackgroundTransparent":  "#563036A5",
    "buttonFont": "#766B6B",
    "foregroundColor":  "#bbbbbb",
    "startColor":  "#6c341d",
    "highlightColor": "#a32f345a",
    "disabledColor": "#585F6F",
    "accentColorTransparent": "#CCA3315A",
    "accentColorLessTransparent": "#CCA3319A",
    "accentColorMoreTransparent": "#CCA3312A",
    "accentColor": "#CCA331",
    "accentContrastColor": "#271c21",
    "stopColor": "#eeb416",
    "testScopeColor": "#243125",
    "popupMask": "#EAEAF00A",
    "codeBlock": "#2f2329",
    "textEditorBackground": "#2f2329",
    "searchResultBackground": "#2A272E",
    "classNameColor": "#dae838",
    "htmlTagColor": "#a28a92",
    "stringColor": "#ffd866",
    "keyColor": "#a28a92",
    "keywordColor": "#a28a92"
  },
  "ui": {},
  "icons": {}
}