{
  "id": "c915211e-faab-4696-8af2-230892052ba6",
  "name": "Eleniel",
  "displayName": "Eleniel",
  "dark": true,
  "author": "cyclic-reference",
  "group": "Mistress",
  "editorScheme": {
    "type": "custom",
    "file": "Eleniel.xml"
  },
  "stickers": {
    "default": "eleniel.png"
  },
  "colors": {
    "baseIconColor": "#808597",
    "ghostColor": "#FFFFFF00",
    "contrastColor": "#2e2b32",
    "nonProjectFileScopeColor":  "#483d3e",
    "editorBackground": "#3B3541",
    "secondaryBackground": "#3e3642",
    "selectionForeground": "#ffffff",
    "inactiveBackground": "#49434c",
    "inactiveBackgroundDarker": "#3c373f",
    "headerColor": "#3B3541",
    "baseBackground": "#3B3541",
    "borderColor": "#3f393f",
    "buttonColor": "#443e48",
    "selectionInactive": "#4c454f",
    "tagColor": "#7A7A7A",
    "secondaryForegroundColor": "#9e9199",
    "selectionBackground":  "#58515C",
    "selectionBackgroundTransparent":  "#58515C",
    "buttonFont": "#91858c",
    "foregroundColor":  "#bbbbbb",
    "startColor":  "#6e6773",
    "highlightColor": "#4b4351",
    "disabledColor": "#525C6F",
    "accentColorTransparent": "#52C4E65A",
    "accentColorLessTransparent": "#52C4E69A",
    "accentColorMoreTransparent": "#52C4E62A",
    "accentColor": "#52C4E6",
    "accentContrastColor": "#2e2b32",
    "stopColor": "#76ffff",
    "testScopeColor": "#3A5841",
    "popupMask": "#EAEAF020",
    "codeBlock": "#39363F",
    "textEditorBackground": "#403D46",
    "searchResultBackground": "#4c454f",
    "classNameColor": "#AA9BEF",
    "htmlTagColor": "#bca3aa",
    "stringColor": "#f1fa8c",
    "keyColor": "#bca3aa",
    "keywordColor": "#bca3aa"
  },
  "ui": {},
  "icons": {}
}