{
  "id": "19b65ec8-133c-4655-a77b-13623d8e97d3",
  "name": "Ryuko",
  "displayName": "Ryuko",
  "dark": true,
  "author": "cyclic-reference",
  "group": "Kill la Kill",
  "editorScheme": {
    "type": "template",
    "name": "Doki Dark"
  },
  "stickers": {
    "default": "ryuko.png",
    "secondary": "ryuko_senketsu.png"
  },
  "colors": {
    "baseIconColor": "#717981",
    "ghostColor": "#FFFFFF00",
    "contrastColor": "#262c32",
    "nonProjectFileScopeColor":  "#373c39",
    "editorBackground": "#2f2329",
    "secondaryBackground": "#282f35",
    "selectionForeground": "#E2CB14",
    "inactiveBackground": "#2a272e",
    "inactiveBackgroundDarker": "#333037",
    "headerColor": "#2b3238",
    "baseBackground": "#2f363c",
    "borderColor": "#2e353a",
    "buttonColor": "#2b3237",
    "selectionInactive": "#292e34",
    "tagColor": "#7A7A7A",
    "secondaryForegroundColor": "#766B6B",
    "selectionBackground":  "#403033",
    "selectionBackgroundTransparent":  "#403033A5",
    "buttonFont": "#766B6B",
    "foregroundColor":  "#bbbbbb",
    "startColor": "#511c22",
    "highlightColor": "#403033",
    "disabledColor": "#585F6F",
    "accentColorTransparent": "#a730355A",
    "accentColorLessTransparent": "#a730359A",
    "accentColorMoreTransparent": "#a730352A",
    "accentColor": "#a73035",
    "accentContrastColor": "#271c21",
    "stopColor": "#ee2726",
    "testScopeColor": "#2d3e3a",
    "popupMask": "#EAEAF00A",
    "codeBlock": "#2f2329",
    "textEditorBackground": "#2b3238",
    "searchResultBackground": "#2A272E",
    "classNameColor": "#dae838",
    "htmlTagColor": "#a28a92",
    "stringColor": "#ffd866",
    "keyColor": "#a28a92",
    "keywordColor": "#a28a92"
  },
  "ui": {},
  "icons": {}
}