{
  "id": "436ff3a0-4072-4b38-8d6f-888b18b5d0ab",
  "name": "Sanya",
  "displayName": "Sanya",
  "dark": true,
  "author": "cyclic-reference",
  "group": "Mistress",
  "editorScheme": {
    "type": "custom",
    "file": "Sanya.xml"
  },
  "stickers": {
    "default": "sanya.png"
  },
  "colors": {
    "ghostColor": "#FFFFFF00",
    "contrastColor": "#341F2D",
    "nonProjectFileScopeColor":  "#413037",
    "editorBackground": "#362839",
    "secondaryBackground": "#382639",
    "selectionForeground": "#ffffff",
    "inactiveBackground": "#49434c",
    "inactiveBackgroundDarker": "#3c373f",
    "headerColor": "#3d2536",
    "baseBackground": "#3a2333",
    "borderColor": "#432E3D",
    "buttonColor": "#341F2D",
    "selectionInactive": "#883552",
    "tagColor": "#7A7A7A",
    "secondaryForegroundColor": "#9e9199",
    "selectionBackground":  "#af1f51",
    "selectionBackgroundTransparent":  "#af1f5155",
    "buttonFont": "#bbbbbb",
    "foregroundColor": "#b5a3b0",
    "startColor":  "#6d4466",
    "highlightColor": "#403046",
    "disabledColor": "#525C6F",
    "accentColorTransparent": "#C6FF005A",
    "accentColorLessTransparent": "#C6FF009A",
    "accentColorMoreTransparent": "#C6FF002A",
    "accentColor": "#C6FF00",
    "accentContrastColor": "#362839",
    "stopColor": "#ec1f62",
    "testScopeColor": "#28382D",
    "popupMask": "#EAEAF009",
    "baseIconColor": "#6B678A",
    "codeBlock": "#322130",
    "textEditorBackground": "#382536",
    "searchResultBackground": "#4C294A",
    "classNameColor": "#c1ff10",
    "htmlTagColor": "#BD84DD",
    "stringColor": "#f1fa8c",
    "keyColor": "#BD84DD",
    "keywordColor": "#BD84DD"
  },
  "ui": {},
  "icons": {}
}