{
  "id": "91415015-8fe3-48eb-9951-70a5cd6cbb7f",
  "name": "Natsuki Light",
  "displayName": "Natsuki",
  "dark": false,
  "author": "cyclic-reference",
  "group": "Literature Club",
  "editorScheme": {
    "type": "templateExtension",
    "file": "Natsuki_Light.xml"
  },
  "stickers": {
    "default": "natsuki.png",
    "secondary": "natsuki_joy.png"
  },
  "colors": {
    "baseIconColor": "#7F707A",
    "ghostColor": "#FFFFFF00",
    "contrastColor": "#f0c3e3",
    "nonProjectFileScopeColor": "#FFE4E3",
    "editorBackground": "#f0d4e1",
    "secondaryBackground": "#f3cfe0",
    "selectionForeground": "#ffffff",
    "inactiveBackground": "#eed4ec",
    "inactiveBackgroundDarker": "#ebd1e9",
    "headerColor": "#FFE0F0",
    "baseBackground": "#fbdde9",
    "borderColor": "#F1D7E6",
    "buttonColor": "#e5c5d3",
    "selectionInactive": "#FFD9E2",
    "tagColor": "#7A7A7A",
    "secondaryForegroundColor": "#36363A",
    "selectionBackground": "#dc99bb",
    "buttonFont": "#252427",
    "foregroundColor":  "#000000",
    "startColor":  "#F25AAF",
    "highlightColor": "#f7d2e8",
    "disabledColor": "#cbb1c6",
    "accentColorTransparent": "#E946865A",
    "accentColorLessTransparent": "#E946869A",
    "accentColorMoreTransparent": "#E946862A",
    "accentColor": "#E94686",
    "accentContrastColor": "#252427",
    "stopColor": "#fbadff",
    "testScopeColor": "#ede8e4",
    "popupMask": "#EAEAF030",

    "codeBlock": "#FDD8FF",
    "textEditorBackground": "#FFE5F1",
    "searchResultBackground": "#F1E5FA",
    "classNameColor": "#df81b8",
    "htmlTagColor": "#7B6970",
    "stringColor": "#DC872E",
    "keyColor": "#7C75EF",
    "keywordColor": "#C869A3"
  },
  "ui": {
    "CompletionPopup.background": "testScopeColor",
    "CompletionPopup.selectionForeground": "selectionForeground",
    "CompletionPopup.selectionBackground": "selectionBackground",
    "CompletionPopup.selectionInactiveBackground": "selectionBackground",

    "SearchEverywhere.Tab.selectedBackground": "selectionBackground",
    "SearchEverywhere.Header.background": "headerColor",
    "SearchEverywhere.SearchField.background": "headerColor"
  },
  "icons": {}
}